{
  "$schema": "../schemas/simple-page/simple-page.schema.json",
  "slug": "teleprompter-guide",
  "published": true,
  "title": "Teleprompter Guide",
  "seo": {
    "title": "Teleprompter Guide | How to Use SolPrompter",
    "description": "A step-by-step guide to the SolPrompter online teleprompter — add a script, choose a scroll mode, adjust your reading view, use notch mode, connect a remote and record in Full HD or 4K."
  },
  "content": [
    {
      "type": "paragraph",
      "html": "SolPrompter is a browser-based teleprompter for presenting and recording. This guide walks you through everything from adding your script to recording a finished take — no installation and no account required."
    },
    {
      "type": "heading",
      "text": "1. Add your script"
    },
    {
      "type": "paragraph",
      "html": "Start on the SolPrompter home page. You can paste or type your script directly, or upload an existing file from your device."
    },
    {
      "type": "list",
      "items": [
        "Paste or type: click into the script box and enter your text.",
        "Upload a file: use the Upload button, or drag and drop a file onto the page.",
        "Supported formats: TXT, DOCX and Markdown files, or plain pasted text."
      ]
    },
    {
      "type": "image",
      "src": "/media/guide/step-1-add-script.webp",
      "alt": "SolPrompter home page with a script pasted into the script box, ready to start presenting",
      "width": 1600,
      "height": 836,
      "caption": "Paste or upload your script on the home page, then press Start Presenting."
    },
    {
      "type": "heading",
      "text": "2. Open the teleprompter"
    },
    {
      "type": "paragraph",
      "html": "Once your script is ready, open it to launch the teleprompter view. Your text fills the screen, ready to read. You can present as-is, or turn on your camera to record while you read."
    },
    {
      "type": "image",
      "src": "/media/guide/step-2-teleprompter-view.webp",
      "alt": "The SolPrompter teleprompter view showing large white script text on a dark background, with the format toolbar at the top and camera, mirror, notch, speed and settings controls at the bottom",
      "width": 1600,
      "height": 836,
      "caption": "The teleprompter view — your script fills the screen, with all controls one click away."
    },
    {
      "type": "heading",
      "text": "3. Choose your scroll mode"
    },
    {
      "type": "paragraph",
      "html": "SolPrompter offers three ways to move through your script so you can present at a pace that feels natural."
    },
    {
      "type": "list",
      "items": [
        "AI Voice Scroll — SolPrompter listens to your speech and scrolls automatically at your natural speaking pace. Turn it on, allow microphone access and simply start talking; the script follows you and waits when you pause.",
        "Auto-scroll — the script scrolls at a fixed speed. Open the Speed control to set your words-per-minute (WPM); the default is 110 WPM. Use the slider or type a custom value.",
        "Manual scroll — control the script yourself with the arrow keys or by scrolling on a touchscreen, for a traditional autocue feel."
      ]
    },
    {
      "type": "image",
      "src": "/media/guide/step-3-scroll-speed.webp",
      "alt": "The autoscroll speed panel open in the teleprompter, with a slider set to 110 words per minute and a custom value field",
      "width": 1600,
      "height": 836,
      "caption": "Open the Speed control to set your auto-scroll pace in words per minute."
    },
    {
      "type": "paragraph",
      "html": "Press Play — or the Space bar — to start and pause scrolling at any time."
    },
    {
      "type": "heading",
      "text": "4. Adjust your reading view"
    },
    {
      "type": "paragraph",
      "html": "Use the format toolbar to make the script comfortable to read from where you sit or stand."
    },
    {
      "type": "list",
      "items": [
        "Font size — choose from 16px up to 48px.",
        "Text style — apply bold (Ctrl+B), italic (Ctrl+I) or underline (Ctrl+U).",
        "Text color — pick a preset or choose a custom color.",
        "Alignment — align text left, center or right.",
        "Mirror mode — flip the text horizontally for use with a beam-splitter rig or when the camera sits beside you.",
        "Eye line — drag the horizontal guide to mark where to look for the most natural eye contact.",
        "Margins — drag the left and right guides to set your reading width."
      ]
    },
    {
      "type": "heading",
      "text": "5. Use Notch Mode for natural eye contact"
    },
    {
      "type": "paragraph",
      "html": "Notch Mode places a compact reading window near the top of your screen, close to your camera, so your eyes stay near the lens."
    },
    {
      "type": "list",
      "items": [
        "Turn on Notch Mode from the toolbar.",
        "Drag the window to position it directly under your camera.",
        "Resize it from the edges or corners to show only the lines you need.",
        "Edit the text in place — your changes sync back to the main script."
      ]
    },
    {
      "type": "image",
      "src": "/media/guide/step-5-notch-mode.webp",
      "alt": "Notch Mode active in SolPrompter, with a compact reading window at the top of the screen near the camera and the rest of the screen dimmed",
      "width": 1600,
      "height": 836,
      "caption": "Notch Mode places a compact reading window right next to your camera."
    },
    {
      "type": "heading",
      "text": "6. Control SolPrompter from another device"
    },
    {
      "type": "paragraph",
      "html": "Remote control lets you run the teleprompter from a second phone, tablet or computer, so you never have to touch your recording device mid-take."
    },
    {
      "type": "list",
      "items": [
        "Open the remote option and connect your second device.",
        "Start and pause scrolling.",
        "Speed the scroll up or slow it down.",
        "Jump forward, back or to another section of your script.",
        "Start or stop recording, where your device and browser support it."
      ]
    },
    {
      "type": "heading",
      "text": "7. Record your video"
    },
    {
      "type": "paragraph",
      "html": "SolPrompter combines the teleprompter and your camera in one place, so you can read naturally and record without switching apps."
    },
    {
      "type": "list",
      "items": [
        "Turn on your camera to see a live preview and check your framing.",
        "Open Settings to pick a resolution — SD, HD, Full HD (1080p), 2K or 4K — and a video ratio such as landscape, square or portrait.",
        "Enable the microphone for audio, and optionally a 3-second countdown before recording.",
        "Press Record to begin, read your script, then press Stop to finish.",
        "Review your take, then record again or keep it."
      ]
    },
    {
      "type": "image",
      "src": "/media/guide/step-7-record-settings.webp",
      "alt": "The SolPrompter settings panel showing resolution set to Full HD, plus countdown, fullscreen and dark theme options",
      "width": 1600,
      "height": 836,
      "caption": "Pick your recording resolution and countdown options in Settings."
    },
    {
      "type": "paragraph",
      "html": "Recordings are saved privately on your device and never carry a SolPrompter watermark."
    },
    {
      "type": "heading",
      "text": "8. Manage scripts and recordings"
    },
    {
      "type": "paragraph",
      "html": "Keep everything organized in one workspace so it is ready for your next presentation."
    },
    {
      "type": "list",
      "items": [
        "Create and edit scripts directly in SolPrompter.",
        "Organize scripts into folders, and rename or move them as needed.",
        "Reuse a script anytime — it reopens with your saved reading settings.",
        "Find every recording in the Recordings library, linked to the script it came from.",
        "Export a script as a file to back it up or move it, and import it again later."
      ]
    },
    {
      "type": "image",
      "src": "/media/guide/step-8-workspaces.webp",
      "alt": "The SolPrompter workspace with a YouTube Videos folder and a saved script card showing a preview of its opening lines",
      "width": 1600,
      "height": 836,
      "caption": "Your workspace keeps scripts, folders and recordings organized in one place."
    },
    {
      "type": "heading",
      "text": "Keyboard shortcuts"
    },
    {
      "type": "paragraph",
      "html": "Speed up your workflow with these shortcuts on desktop."
    },
    {
      "type": "list",
      "items": [
        "Space — play or pause scrolling.",
        "Up / Down arrows — scroll up or down.",
        "Left / Right arrows — decrease or increase scroll speed.",
        "Enter — jump to the next paragraph.",
        "Ctrl+B, Ctrl+I, Ctrl+U — bold, italic or underline."
      ]
    },
    {
      "type": "heading",
      "text": "Tips for a great take"
    },
    {
      "type": "list",
      "items": [
        "Position the reading area as close to your camera lens as possible.",
        "Use AI Voice Scroll or a comfortable WPM so you never feel rushed.",
        "Record a short test clip to check framing, lighting and audio first.",
        "Keep sentences short and add line breaks where you want to pause."
      ]
    },
    {
      "type": "paragraph",
      "html": "That is everything you need to present and record with SolPrompter. Open the app, add your script and start speaking naturally."
    }
  ]
}
